id	sim	sent_1	sent_2
MSRpar#SP302	3.692	قال السيد ماسك أنه من الممكن أن يتم أخذ  السيد كولين من سجن مقاطعة سومرست قبل يوم الخميس ونقله إلى مستشفى آن كلاين الشرعي للرعاية النفسية خارج ترينتون .	تم نقل تشارلز كولين (43 عاما) من سجن مقاطعة سومرست في سومرفيل إلى مركز الطب الشرعي آن كلاين، إلى السرير رقم 150 في منشأة لمعالجة الأمراض النفسية في ترينتون.
MSRpar#SP303	3	يعتقد العلماء أن ستاردست تحصر بداخلها الآلاف من جزيئات الغبار.	تم تصميم ستاردست لجمع الآلاف من جزيئات الغبار المتدفقة من وايلد 2.
MSRpar#SP304	3	كسر حاجز الصوت بعد تسع ثوان، واستمر بالصعود الشديد الدعوم.	قالت الشركة "أن سبيس شيب ون اخترق حاجز الصوت بعد تسع ثوان .
MSRpar#SP305	2.75	يهدف التقرير الذي أعدته لجنة  الخبراء المستقلة ، إلى تبديد أي شك  حول كيفية تعامل حكومة هونغ كونغ مع متلازمة السارس.	تم إطلاق التقريرالذي طال انتظاره حول كيفية تعامل حكومة هونج كونج مع تفشي متلازمة السارس.
MSRpar#SP306	3.25	قدر وزن  الطائرة حوالي 100 باوند كحد الأقصى للوزن عند إقلاعها.	رحلة الطيران رقم5481،  على متن الخطوط الجوية الأمريكية التي تحطمت في8 يناير،تم الحكم عليها في  أن يكون وزنها كحد أقصى عند الإقلاع في حدود 100 باوند .
MSRpar#SP308	3.75	مايكل بلومبيرغ، عمدة مدينة نيويورك: " سأحاول السير مع عدد من المجموعات المختلفة.	قال بلومبرغ "سأحاول القيام بمسيرة مع عدد من المجموعات المختلفة.
MSRpar#SP309	3.6	يبدو أن الهجوم شبيه  لغيره من الهجمات التي تم تنظيمها بالقرب من المجمعات السكنية الأجنبية في الرياض يوم 12 مايو.	يبدوأن الهجوم مماثل للهجمات التي شنت بالقرب من المجمعات السكنية الأجنبية في الرياض يوم 12 مايو، حيث ألقى فيها المسؤولون اللوم على تنظيم القاعدة.
MSRpar#SP31	3	تراجعت البرامج النصية الصريحة الخاصة بالأسهم ESRX.o بنسبة 3.6 في المئة ، لتغلق عند 66.89 دولارا في بورصة ناسداك.	انخفضت الأسهم في البرامج النصية  ESRX.O حوالي 4 في المئة لتصل إلى 66.73 دولارا في بورصة ناسداك في التداولات المتأخرة من هذا الصباح.
MSRpar#SP310	3.5	انخفاض أسعار الجملة الأساسي في أبريل يعكس انخفاض أسعاركل من  السيارات والشاحنات ،ملابس الأولاد والرجال، والسجائر	كان ذلك أكبر انخفاض منذ شهر أغسطس  من عام1993، حيث ينبع من انخفاض أسعاركل من السيارات والشاحنات ،ملابس الرجال والأولاد ،والسجائر.
MSRpar#SP311	5	قال الرابح أن اثنين من مساعدي الموظفين "يأسفون جدا على كل ماحدث "حيث قام  أفراد الأمن بأداء "جيد و ضمن المعايير."	قال الرابح :كان عمل أفراد الأمن " جيدا وضمن المعايير " حيث كان اثنين من مساعدي الموظفين " جدا آسفون على كل ما حدث .
MSRpar#SP312	3.75	لقد وضعنا الكثير من الجهد والطاقة في تحسين عملية الترقيع لدينا، وربما في وقت لاحق يجب علينا ،أما الآن نحن فقط نكسب سرعة خيالية.	"لقد وضعنا الكثير من الجهد والطاقة في تحسين عملية  الترقيع لدينا، وربما في وقت لاحق ينبغي علينا .
MSRpar#SP313	3.000	يبحث  عمال الإنقاذ الدولي بين الأنقاض، عن ناجين في مدينة بام الواقعة على  طريق الحريرالقديمة في إيران، والتي دمرت جراء زلزال قوي قتل فيه أكثر من 20،000 شخص	"بحث عمال الإنقاذ الدولي بشكل كثيف بالأمس ،عن ناجين بين الأنقاض، وفي المقابرالتي فاضت بالماء ، في مدينة بام الواقعة على طريق الحرير القديم في إيران
MSRpar#SP314	4	غريفيث، وهو من مواطني جبل نقي الهواء، يعيش الآن على ساحل ولاية كارولينا الشمالية في مانتيو.	غريفيث (77 عاما)والذي  نشأ على جبل نقي الهواء، يعيش الآن في مانتيو.
MSRpar#SP315	3.333	قال كذلك أن الاكاديمية ستحصل على تقريرها  الداخلي الخاص بها في الأسبوع المقبل ،مفصلا فيه عن خطورة المشكلة المتبقية.	قالت روزا "ستحصل الأكاديمية في الأسبوع المقبل على تقريرها الداخلي الخاص بها ،حيث سيكون عاما .
MSRpar#SP316	3.333	قال الرئيس : أن الصبي قام  أيضا برش غرفة مليئة بالمثبطات من طفايات الحريق، الأمر الذي جعل الرؤية صعبة .	قال الرئيس : أن الصبي فر مرة واحدة نحو الجدار، ورش الغرفة باستخدام طفايات الحريق، مما جعل الرؤية صعبة
MSRpar#SP317	4.667	جاء في تقرير مجلس المؤتمر أن مؤشر ثقة المستهلك الأمريكي تراجع  من 83.6 في شهر مايو إلى 83.5 في شهر يونيو.	قال مجلس المؤتمر "أن  مؤشر ثقة المستهلك استقر عند83.5  في شهر يونيو، بانخفاض طفيف عن الميزانية المعدلة لشهر مايو وهي 83.6 .
MSRpar#SP318	3.333	قال أحد السياسيين :" لقد لاحظت تغيرا في المزاج العام في ما يخص أولوياتهم "	قال أحد السياسيين العراقيين بعد اجتماعه مع السيد بريمر: "لقد لاحظت تغيرا في المزاج العام في ما يخص أولوياتهم "
MSRpar#SP319	2.6	بينما (اتش ار تي )لا ينبغي أن تستخدم لمنع أمراض القلب أو أي مرض مزمن آخر	قال منسون :" الرسالة الواضحة هنا هو أنه لا يجب أن تستخدم لمنع أمراض القلب والشرايين".
MSRpar#SP320	2.4	هيذر (35 عاما) ،والتي فقدت ساقها في حادث سير، من الممكن  أن يتم تركيب ألواح فولاذية في وركها، والتي من شأنها أن تؤدي إلى استحالة عملية الولادة الطبيعية .	"فقدت عارضة الأزياء السابقة السيدة مكارتني ساقها في حادث سير في عام 1993، ومن الطبيعي أن يكون قد تم تركيب ألواح فولاذية في وركها ، والتي من شأنها أن تجعل الولادة الطبيعية أمرا صعبة.
MSRpar#SP322	1.800	تمت مصادرة كل من اللحوم ،الدواجن، الزبدة،الأجبان والمكسرات قبل عام، في مستودع مخزن لاجرو كولد في شيكاغو.	يتم تخزين كل من اللحوم ،الدواجن، الزبدة، الأجبان والمكسرات ،من قبل أكثر من 100 تاجر للجملة في شيكاغو.
MSRpar#SP324	2.400	نائب الرئيس ديك تشيني وميسيسيبي الجمهوري المرشحان لمنصب الحاكم العام في هالي بربور، اعترفوا بأن الجموع مبتهجة .	يقول نائب الرئيس ديك تشيني :أن استلام  ميسيسيبي الجمهوري لمنصب الحاكم في هالي بربور يمكن أن يكون جيدا ، بسبب ذكائه في إدارة الحكومة والأعمال الأخرى.
MSRpar#SP325	3.000	عملت الممرضة التي تبلغ من العمر 51 عاما في المستشفى العام ، نورث يورك، أحدث مركز لتفشي المرض .	أصيبت إميل لاروزا ، 51 عاما ، بفيروس بالسارس ،بينما كانت تعمل كممرضة في المستشفى العام نورث يورك، أحدث مركز لتفشي فيروس السارس من النوع الثاني.
MSRpar#SP326	2.000	وقد سمح لروش أيضا بخمسة أشواط فاز بها أو أكثر عند بداية  كل من الأشواط الثلاثة الأخيرة	"سمح لريدمان بشوطين فاز بهما أو أقل ،خلال ستة من تسعة أشواط له .
MSRpar#SP327	1.6	حول السيد تيرنر حوالي 10 مليون سهم إلى صندوق خيري قبل أن يتم بيعها.	تركت المبيعات للسيد تيرنر حوالي 45 مليون سهم في شركة أمريكا أون لاين.
MSRpar#SP328	4	قام بتوظيف أشخاص آخرين أيضا للمشاركة في هذا المشروع ، وذلك عن طريق إقناعهم باستلام بضائع تم الحصول عليها عن طريق الاحتيال، وكانت مخصصة له.	قام أيضا بتوظيف أشخاص آخرين لاستلام بضائع تم الحصول عليها عن طريق الاحتيال ، كانت مخصصة له
MSRpar#SP329	3.6	جاء في تقرير مؤسسة جارتنر أن شحنات المعدات لشركة (دبليو ال آ اى )العالمية حققت مبلغ  19.5 مليونا في العام الماضي، أي بزيادة قدرها 120 في المئة عن أعوام 2001،في 8.9 مليون وحدة.	"بلغ إجمالي الشحنات 19.5 مليون وحدة في العام الماضي، مقارنة مع 8.9 مليون وحدة في عام 2001.
MSRpar#SP33	3.000	بدأت الشرطة يوم السبت مطاردة دولية لشيفون بنينجتون ، بعد أن هربت مع توبي البالغ من العمر 31 عاما.	اختفت صباح يوم السبت شيفون بنينجتون ، بعد الترتيب للقاء مع توبي البالغ من العمر 31 عاما.
MSRpar#SP330	3.800	قام فريق ميتس في نيويورك باختيار لاعب الدفاع لاستينج ميلدج من مدرسة لاكوود رانش الثانوية في ولاية فلوريدا.	ضم فريق ميتس اللاعب لا ستينج ميلدج، وهو لاعب دفاع من ولاية فلوريدا، بموافقة ال 12 لاعب.
MSRpar#SP331	4.400	الآن، مع آخر ثلاث مكوكات تابعة للوكالة ،والمتجمعة  عقب كارثة كولومبيا، يمكن أن يكون هذا الانتظار لفترة أطول.	في أعقاب حادث كولومبيا والذي خلف ثلاث مكوكات متبقية ، يجب على المجندين الجدد الانتظار لفترة أطول.
MSRpar#SP332	3.000	بريمر (61 عاما) عمل كمساعد لمرة واحدة ،لوزراء سابقين للدولة مثل وليام روجرز وهنري كيسنجر، كما كان سفيرا على مستوى عال لمكافحة الإرهاب من العام  1986إلى عام 1989.	بريمر (61 عاما) هو مساعد سابق لوزراء سابقين للدولة مثل وليام روجرز وهنري كيسنجر.
MSRpar#SP333	3.800	روي مور، رئيس القضاة في المحكمة العليا الموقوف في ولاية ألاباما، مثل يوم الأربعاء كمتهم ، في نفس قاعة المحكمة التي كان يترأسها مؤخرا ، ولكنه غير نادم .	"مور، رئيس القضاة الموقوف في المحكمة العليا لولاية ألاباما، يمثل للمحاكمة أمام السلطة القضائية لمحكمة ألاباما .
MSRpar#SP334	3	قفزمتوسط مؤشر داو جونز الصناعي (أسهم الشركات الأمريكية الكبرى )مقدار 164 نقطة أو 1.91 في المئة، ليصل إلى  8،765.38، محققا أعلى مستوياته منذ منتصف شهركانون الثاني.	حافظ متوسط مؤشر داو جونزالصناعي ( أسهم الشركات الأمريكية الكبرى) على 97 نقطة، أو 1.14 في المئة ليصل إلى  8.699.
MSRpar#SP335	4.25	اتهم براينت في مذكرة اعتقال ،في 30 يونيو ،بالاعتداء على امرأة في أحد الفنادق .	وفقا لما جاء في مذكرة الاعتقال،فقد قام براينت (24 عاما) بالاعتداء على امرأة في 30 يونيو.
MSRpar#SP336	1.273	لم يتم الاعتراف بسيناتور فلوريدا ، بوب جراهام ،استنادا إلى 61 في المئة ممن شملهم الاستطلاع.	استنادا إلى66 في المئة من الذين شملهم الاستطلاع ، فقد كان وضع كيري إيجابيا ، حيث حصل على  نسبة 57 في المئة كرتبة عميد .
MSRpar#SP337	1	ارتفع مؤشر  ستاندرد اند بورز500 الأوسع نطاقا ،بمقدار 3.47 نقطة أو 0.36 في المئة ليصل إلى 977.59.	انخفض مؤشر ناسداك كومبوزت لأسهم التكنولوجيا الفائقة لادن بمقدار 8 نقاط، أو 0.45 في المئة ، ليصل إلى 1645.
MSRpar#SP338	3	كانت النتيجة أنه حطم 24 لاعبا الرقم القياسي في الجولة الأولى.	حطم أربعة وعشرون لاعبا الرقم القياسي في الجولة الأولى، وهو أعلى ثالث رقم في تاريخ بطولة الولايات المتحدة المفتوحة .
MSRpar#SP339	4	وفقا لمتحدثة باسم شركة أوراكل: لم يتم طرح تلك المحادثات اعتبارا من ليلة الثلاثاء	وفقا لمتحدثة باسم شركة أوراكل : لم يتم طرح تلك المحادثات .
MSRpar#SP34	4.8	يقول المحامون وغيرهم ممن هم على دراية بالتحقيق الفيدرالي: يبقى التركيز على كامبل، على الرغم من أن النيابة العامة رفضت مناقشة التحقيق.	يقول المحامون وغيرهم ممن هم على دراية بالتحقيق أن التركيزلا يزال على كامبل ، في حين يرفض المدعون الفيدراليون مناقشة التحقيق .
MSRpar#SP340	3.5	احتشد أصدقاء روبرت دي نيرو بالأمس حوله، بعد أن تم تشخيص حالته بأنه مصاب بسرطان البروستاتا.	قال متحدث باسم نجم هوليود ،روبرت دي نيرو اليوم ،أنه تم تشخيصه حالته بوجود سرطان البروستاتا.
MSRpar#SP341	4	أوقفتسل سلتا كل من البرتسونس و رالف كروجر عمالها ، كرد على ذلك.	أوقفت سلسلة رالف كروجروسلسة البرتسونس على الفور عمال البقالة التابعين لها إظهارا للتضامن.
MSRpar#SP342	3.25	حاولت تايوان على مدار سبع سنوات الحصول على منصب مراقب للأمم المتحدة التابعة لمنظمة الصحة العالمية ، ولكن تم الرفض مرة أخرى في مؤتمرها السنوي في جنيف في تاريخ 19 مارس .	سعت على مدار سبع سنوات للحصول على منصب مراقب ، ولكن طلبها قبل بالرفض مرة أخرى ، في 19 مايو ،في مؤتمر منظمة الصحة العالمية السنوي في جنيف.
MSRpar#SP343	2	انخفض مؤشر ناسداك كومبوزت لأسهم التكنولوجيا المعبأة <أسهم التكنولوجيا>بمقدار 37.78 نقطة أو 1.94 في المئة لتصل إلى 1،912.36.	هبط مؤشر ناسداك كومبوزت بمقدار 2.95، أو 0.2 في المئة، خلال الأسبوع ليصل إلى  1،912.36 بعد عثرة بمقدار 37.78 يوم أمس.
MSRpar#SP344	1	أغلقت أسهم المنظمة على نسبة 10.93 دولار، بانخفاض 28 سنتا ،في تداولات الإثنين في بورصة ناسداك.	أغلقت أسهم ( آي بي إم )على نسبة 1.75 دولار، أو 2.11 في المئة ، لتصل إلى 84.50 دولار في سوق نيويورك للأوراق المالية.
MSRpar#SP345	3	صرحت وزارة الصحة يوم الجمعة ،أن رجلا من مقاطعة واشنطن ، يمكن أن يكون  أول حالة بشرية  في البلاد  لفيروس غرب النيل.	تم تأكيد وجود الحالة الأولى والوحيدة من البشر لفيروس غرب النيل هذا العام ،من  قبل مسؤولي الصحة في 8 سبتمبر .
MSRpar#SP346	2.6	قال كريستين إيوان ،الرئيس التنفيذي للمركز الوطني لسرطان الثدي :أنه من السابق لأوانه تقدير حجم المخاطر التي تتعرض لها النساء.	قال كريستين إيوان ،الرئيس التنفيذي للمركز الوطني لسرطان الثدي :ليس هناك داع للذعر .
MSRpar#SP347	2.6	استقال كل من برندسيل والمدير المالي فون كلارك في9 يونيو.	تقاعد الرئيس التنفيذي للشركة  ، بينما استقال المدير المالي.
MSRpar#SP348	4.6	يقول الحزب الوطني أنه لن يكون هناك خصخصة ولا أقساط بشأن الرعاية الصحية .	جدد الديمقراطيون الجدد أيضا التزامهم بعدم وجود خصخصة  أو أي اقساط بشأن الرعاية الصحية .
MSRpar#SP349	3.2	لكن (ج. ت) كان حريصا على توضيح أنه "لا يوجد أي شيء مؤكد حتى الآن حول نتائج المناقشة ."	ومع ذلك، نحن لسنا متأكدين حتى اللآن من نتائج المناقشات
MSRpar#SP35	2.5	سجل مؤشر داو جونز الصناعي لأسهم الشركات الأمريكية الكبرى،  58.69 نقطة عند الخروج، أو 0.64 في المئة ليصل إلى 9،137.86.	انخفض متوسط مؤشر داو جونز( الرقاقة الزرقاء )لأسهم الشركات الأمريكية الكبرى، 86.56 نقطة أو 0.94 في المئة ليصل إلى 9،109.99، بعد التخلي في وقت سابق عن أكثر من 1 في المئة.
MSRpar#SP350	3	صوت 425 عضومن مجلس النواب على اثنين  لإلغاء مشروع القانون، وهو الأول من 13 بندا ،والذي يجب على المؤتمر أن يمرره كل عام لتمويل الحكومة الاتحادية.	"مشروع القانون هو من بين أول 13 بندا ،الذي يجب على الكونجرس أن يمرره كل عام لتمويل الحكومة الاتحادية.
MSRpar#SP351	4.750	وافق نايت على عقد بقيمة 2.380.000 دولار لمدة عامين ،حيث اشتمل على توقيع منحة بقيمة 300،000 دولار .	"ذكرت (إسبن ) أن  الصفقة التي عقدها نايت لمدة عامين تبلغ قيمتها 2.380.000 دولار، بما في ذلك توقيع منحة بقيمة 300،000 دولار.
MSRpar#SP353	4.5	يتم تنفيذ العملية عادة في الثلث الثاني أو الثالث	يتم استخدام هذه التقنية خلال الثلث الثاني ،وأحيانا الثلث الثالث من الحمل.
MSRpar#SP354	2.75	ستبدأ شركات جديدة بالتداول في بورصة ناسداك اليوم تحت رموز مؤشرات الأسهم (بي ال ام أو ) و (بي اس ار سي ).	ستبدأ أسهم شركة (بالم سورس) التداول في سوق الأوراق المالية في بورصة ناسداك ، كجزء من الصفقة ،في الأربعاء تحت الرمز: (بي سي ار سي ).
MSRpar#SP355	2.2	يستعد كل من الأطفال ،البالغين، بائعي المكتبات وعمال البريد ل "هاري بوتر وجماعة العنقاء".	"إن الصناديق مليئة بالنسخ ذات الغلاف المقوى من" "هاري بوتر وجماعة العنقاء".
MSRpar#SP356	3	إلى جانب هامبتون ونيوبورت نيوز ،فإن أموال المنحة المخصصة لاختبار الماء توجد في يورك تاون، مقاطعة الملك جورج وشواطئ نورفولك وفيرجينيا .	المنحة أيضا  تمول اختبار ماء الشاطئ في مقاطعة كينغ جورج، ونورفولك وفيرجينيا بيتش.
MSRpar#SP357	2.4	هبط سهم شركة هاليبرتون 71 سنتا ،أو 3 في المئة، ليغلق عند 21.59 دولار ،في بورصة نيويورك للأوراق المالية بالأمس .	انخفض سهم شركة هاليبرتون 54 سنتا، أو 2.4 في المئة، ليصل إلى 21.76 دولار للسهم في التداولات النصفية في بورصة نيويورك.
MSRpar#SP358	3	قال: أن المهاجمين تركوا منشورات تدعو الموظفين في فندق عشتار شيراتون للتوقف عن العمل ،كما تطالب القوات الأميركية بمغادرة العراق.	قال :أن المهاجمين تركوا منشورات تدعو الموظفين في فندق عشتار شيراتون للتوقف عن العمل .
MSRpar#SP359	3	مع احتدام الدبلوماسية في الأزمة النووية المستمرة منذ 10 أشهر تقريبا، من المقررأن يقوم وزير الخارجية الصينى، لى تشاو شينغ ،بزيارة كوريا الجنوبية في الفترة من 13 إلى 15 أغسطس.	"مع احتدام الدبلوماسية في الأزمة المستمرة منذ 10 أشهر تقريبا، يقوم  وزير الخارجية الصينى، لي تشاو شينغ ، برحلة إلى اليابان يوم الأحد ، سيمر خلالها إلى كوريا الجنوبية في 13 أغسطس .
MSRpar#SP36	2.250	انتصرت قواعد السلام على الإبادة المضحكة في ولاية لويزيانا ديربي.	لكن ،لا هو ولا قواعد السلام يمكنها أن تبقي الإبادة المضحكة بعيدا من السحب.
MSRpar#SP361	2.588	يتمنى بوند بولز على بنك الاحتياطي الفيدرالي أن يدرك أن المخاطرتكمن في الضعف الاقتصادي.	"قال مجلس الاحتياط الاتحادي أيضا أن المخاطر التي يتعرض لها الاقتصاد تسير نحو الضعف.
MSRpar#SP362	3.6	قال حاكم الولاية جيمس مكجريفي : "هناك إمكانية حقيقية لانهيار الثانوية".	قال '' مكجريوى ": لم تكن  المنطقة المتضررة من المرآب بحالة مستقرة، مع احتمال حقيقي لانهيار الثانوية.
MSRpar#SP363	4.667	ضمن 97 بالمئة من الأصوات ، 68 في المئة من الناخبين صوتوا ب "لا" للضريبة ، في منتصف ليلة الأربعاء .	"مع 97 في المئة من إحصائيات الدوائر الانتخابية هذه الليلة، عارض 68 في المئة من الناخبين قانون الضرائب .
MSRpar#SP364	3.333	لم تحدد الحكومة رواد الفضاء - وهو مصطلح مأخوذ من '' تايكونج'' كلمة صينية تعود للفضاء – وتعني الذي سيسافر في مهمة ثانية.	"إن الحكومة لم تحدد ما هي (تايكونتس)- وهو مصطلح مأخوذ من (تايكونج) ،كلمة صينية تعني الفضاء.
MSRpar#SP366	3.333	من المتوقع أن يتم اليوم ترشيح وانتخاب غراهام  لولاية ثانية مدتها سنة واحدة ،وسيؤدي الخطاب الرئاسي.	كان من المتوقع أن يتم إعادة انتخاب غراهام لولاية ثانية مدتها سنة واحدة، وذلك في وقت لاحق من يوم الثلاثاء .
MSRpar#SP367	3	تابع البيان " أن هذه التغييرات قد تؤثر على عدد كبير من صفحات الويب الموجودة" .	وفقا لإشعار ( دبيليو 3 سي ):لا زالت "التغييرات لشركة آي إي""يمكن أن تؤثر على عدد كبير من صفحات الويب الموجودة".
MSRpar#SP368	2.25	قال الدكتور جيم يونغ، مفوض أونتاريو للسلامة العامة :"من الواضح أن الناس غير مرتاحين ".	قال الدكتور جيمس يونغ، مفوض أونتاريو للسلامة العامة :" نحن في أشد الاستيقاظ ".
