id	sim	sent_1	sent_2
MSRpar#SP572	3.8	يواجه راي برينت 29 عاماتهما متعددة حول احتيال في خدمة دفن، وإدلاء بأقوال كاذبة، وإساءة لجثة ميت والسرقة	يواجه راي برينت 29 عاما أيضا تهمة إساءة لجثة ميت وسرقة
MSRpar#SP573	3.4	وبعد ذلك طلبت كلية بريسيدنت باول بريبينو منه أن يختتم كلمته	بعد تحفظ انقطاع الميكروفون للمرة الثانية، طلب بريبينو منه اختتام كلمته
MSRpar#SP574	3.857	خلال فترة ال 12 شهر المنتهية في 30 يونيو، ارتفعت نسبة الخطوط عالية السرعة المركبة في المنازل والشركات بنسبة 45 %	خلال كامل السنة المنتهية في 30 يونيو، ارتفعت نسبة الخطوط ذات السرعة العالية إلى 45 %
MSRpar#SP575	4	انتهى تاريخ ريكي كليمونس المقتضب المضطرب في كرة سلة ميسوري	طردت ميسوري ريكي كليمونز من فريقها، منهية تاريخه المزعج فيه
MSRpar#SP576	3.4	يقول مسؤولون عسكريون أميركيون إن غسل الدوار في المروحية قد يؤدي إلى تفجير اللافتة	يقول مسؤولون أميركيون إن غسل الدوار السفلي المولد من قبل المروحية المحلقة قد أزال العلم من فوق البرج
MSRpar#SP577	3.2	تحث أكبر جمعية في هذه الصناعة أعضاءها على عدم الاتصال بما يزيد عن 50 مليون رقم هاتف أرضي أو خلوي على القائمة	في غضون ذلك قالت جمعية التسويق المباشر إنه يجب على أعضائها عدم الاتصال بما يقرب من 51 مليون رقم محدد على القائمة
MSRpar#SP578	3	تم التوصل إلى التسوية نافذة المفعول هذا الأسبوع بعد اقل من شهرين على تولي أومالي إدارة رابع أكبر أبرشية محلية	تم التوصل إلى معاهدة الـ 85 مليون دولار في شهر سبتمبر، بعد لإقل من شهرين على تولي الأسقف سين أومالي كمدير لرابع أكبر أسقفية محلية
MSRpar#SP579	3.2	قالت شرطة الكونغريس إنه تم بالأمس إخلاء الكونغريس الأمريكي بعد أن كشفت السلطات عن احتمال وجود مواد خطيرة في جناح الشيوخ في الطابق السفلي	أخلت شرطة الكونغريس الأمريكية المبنى بالأمس كشف المجس عن احتمالية وجود أسلحة بيولوجية في جناح الشيوخ، ولكن قالت السلطات في وقت لاحق إنه كان إنذارا خاطئا
MSRpar#SP580	3.6	وقال المتحدث باسمه جيم كينيدي، كما ألقى الرئيس السابق العديد من الخطب في عام 2002 دون تعويض	وقال المتحدث باسمه جيم كينيدي، كما ألقى الرئيس السابق أكثر من 70 كلمة في عام 2002 دون تعويض
MSRpar#SP581	1.6	انخفض مؤشر ستاندرد آند بورز 500 الواسعة الانتشارإلى 971.52، بقيمة 0.04 نقطة ، أو 0 في المائة	انخفضت العقود الآجلة لمؤشر أسهم شركة ستاندرد آند بورز 500 عند 965.70 بقيمة 2.60 نقطة، بينما انخفضت عقود ناسداك الآجلة إلى 1،183.50 بقيمة 7.50 نقطة
MSRpar#SP583	2.6	اتهم العمال  جنرال دايناميكس بالتمييز العمري العكسي بسبب تغيير في استحقاقات التقاعد عام 1997	تمت  مقاضاة جنرال دايناميكس حين غيرت استحقاقات التقاعد الخاصة بها عام 1997
MSRpar#SP585	2	اتهم أحد الشخصيات المهمة في محطط رشوة أمين صندوق الدولة السابق بول سلفستر يوم الأربعاء ، بتغيير قصته حول تعاملات سلفستر الفاسدة المزعومة مع شركة بوسطن الاستثمارية	شهد لاعب أساسي في مخطط رشوة أمين الصندوق السابق بول سلفستر يوم الثلاثاء حول عمولات ورشاوى تداولها سلفستر لأعمال الدولة
MSRpar#SP586	3.6	كانت مهمة نظام CAPP الثاني وسوف تظل دائما هي أمن الطيران" قالت الإدارة، جزء من وزارة الأمن الداخلي	لقد قالوا "إن مهمة  نظام CAPPS كانت وستظل هي أمن الطيران"
MSRpar#SP587	4.5	لم يتكلم هوفن ، ولكن محاميه، جون سبيرانزا، قال إن موكله "لم يستيقظ ذلك اليوم" معتزما إيذاء أي أحدا	وقال محامي الدفاع جون سبيرانزا إن هوفان، لم يستيقظ ذلك اليوم عازما على إيذاء أي أحد
MSRpar#SP588	4	كتب داشل " نعتقد أنه ليس بالضرورة أن يكون بيننا صراع معزز للانقسام حول موعد المجكمة العليا	كتب داشيل للرئيس الجمهوري " نعتقد أنه لا ضرورة لوجود صراع معزز للانقسام "
MSRpar#SP589	3	وجدت الدرااسة ان حسابات ياهو لـ159،354 لمواقع الـ BSD، مع 152،054 من NTT/Verio  و 129،378 Infospace	وجد المسح أن 152،054 أخرى هي من خدمات شركة IP NTT/Verio ، ومن 129،378 InfoSpace
MSRpar#SP590	2.5	إن مهمة مرفق التليسكوب الفضائي ذو الأشعة تحت الحمراء هي البحث عن بدايات الكون	ومن المقرر أن تطلق ناسا مرفق التليسكوب الفضائي ذو الأشعة تحت الحمراء صباح يوم الإثنين
MSRpar#SP591	3.5	وقد أنتج صانعها ، شركة ميد اميون، ومقرها غايذر سبيرغ 4 مليون إلى 5 مليون جرعة هذا العام	أنتجت شركة ميد اميون فاكسينز "لقاحات ميد اميون"، صانعة فلوميست، ما بين 4 مليون و5 مليون جرعة هذا العام
MSRpar#SP592	3	ظهرت كايتشن يوم الأربعاء في المحكمة الفدرالية في تهمتي سطو على بنك	ظهرت كايتشن يوم الأربعاء في المحكمة الفدرالية، ولكنها لم تقدم التماسا
MSRpar#SP593	3.769	أعلنت الشبكة أنه في إحدث حركة تعدبلات  عالية المستوى في الـ CNN، ستترك تيا ريان منصبها كمدير عام لبرمجة الولايات المتحدة	في أحدث حركة إعادة تصنيف في الـ CNN، أطاحت الشبكة بتيا ريان، مديرعام برمجة الولايات المتحدة
MSRpar#SP594	3.4	ويشتبه في كونه شخصية بارزة في الجماعة الإسلامية، التابعة لجماعة تنضيم القاعدة الإرهابية، والتي اعتبرت مسؤولة عن التفجيرات	يشتبه في كون سامودرا، 32 عاما، شخصية بارزة في الجماعة الإسلامية الجماعة الإرهابية التابعة لتنظيم القاعدة، والتي اعتبرت مسؤولة عن تنفيذ التفجيرات
MSRpar#SP595	1.8	وقال رئيس فرقة الإطفاء ألبوكيرك  روبرت أورتيغا ، يوجد حوالي 100 رجل إطفاء في البوسكي اليوم	قال روبرت أورتيغا رئيس فرقة ألبوكيرك للإطفاء " لقد كنا على بعد ثوان من حدوث ذلك"
MSRpar#SP596	3	وقال رئيس المارلينز ديفيد سامسون عل لسان المتحدث باسم النادي: " لقد تم حل هذه المشكلة"	وقال المارلينز فقط: "لقد تم حل هذه المشكلة"
MSRpar#SP597	3	قالت وزارة الصحة الصينية إن خمسة أشخاص آخرين قد لقوا حتفهم بسبب مرض السارس بالإضافة إلى 159 مصابا بالعدوى	قالت الصين يوم الإثنين إن تسعة أشخاص آخرين قد لقوا حتفهم بسبب السارس أن 160 آخرين أصيبوا بعدوى الفيروس
MSRpar#SP598	3.4	ودعت المجلة الطبية المحترمة لانست إلى فرض حظر كامل على التبغ في المملكة المتحدة	دعت المجلة الطبية الرئيسة في المملكة المتحدة إلى فرض حظر كامل على التبغ ، مما أثار غضب جماعة المدخنين
MSRpar#SP600	3.25	خطوة إضافية سجلها باحثون في جامعة كاليفورنيا، أن سان فرانسيسكو هي الأحدث في جهد استمر عشر سنوات	الخطوة الإضافية التي قيدها الباحثون في جامعة كاليفورنيا أن سان فرانسيسكو هي الأحدث في جهد استمر عقدا من الزمن لإصابة الفئران بعدوى الفيروس
MSRpar#SP601	4	وقال إن إدارة الأغدية والعقاقير إنها كانت تأمل في أن يقدم الكونغريس والمحاكم توضيحا للموقف وبعض المساعدات المالية للمستهلكين	وقال إن إدارة الأغدية والعقاقير إنها كانت تأمل في أن يقدم الكونغريس والمحاكم توضيحا للموقف وبعض المساعدات المالية للمستهلكين ربما قبل انتخابات عام 2004
MSRpar#SP602	4	لم يعترف إرنست ويونغ بأي فعل خاطئ مع التسوية	قال النتحدث باسم أرنست ويونغ إن الشركة لا تعترف بأية مخالفات
MSRpar#SP603	4	لقد هرب سائق الشاحنة ويجري الآن البحث عنه من قبل الشرطة	ولكن تقول الشرطة إنه لم يتم العثور على سائق الشاحنة وإنه مطلوب للتحقيق
MSRpar#SP604	3.625	كان الشاهد الكوسوفي 27 عاما حارس المواقف صاحب الإدانات الجنائية لخيانة الأمانة قد تقاضى 10،000 من أخبار العالم	سمعت المحكمة أن الشاهد حارس المواقف الكوسوفي ذا الـ 27 عاما هم من تم الدفع له من قبل أخبار العالم
MSRpar#SP605	4.25	قال بوش " بطرق مختلفة وعديدة كانت براعة الموسيقيين السود الفنية تنقل تجربة الأمريكيين السود على مدار تاريخنا"	قال بوش محاطا بمطربي هارليم:" كانت براعة الموسيقيين السود الفنية تنقل تجربة الأمريكيين السود على مدار تاريخنا"
MSRpar#SP606	3.5	لقد باتت الاختلافات بين جراسلي وثوماس حول الطاقة والرعاية الصحية حادة جدا،حيث يقول الأعضاء الآخرون إن علاقتهم المحتدمة أمر محرج للحزب	لقد باتت اختلافاتهم حول الطاقة والرعاية الصحية حادة للغاية مما جعل الأعضاء الآخرين للقول بأن ذلك محرج للحزب
MSRpar#SP607	4	قالت جيرالدين أندرو زوجة ابن القس، إن روبنسون قد أخرج ابنتها من مصحة للأمراض النفسية	قالت جيرالدين أندرو زوجة ابن رينولدس وصديقة عائلة ويلسون، إن روبنسون كان قد أخرج ابنتها مؤخرا من مصحة للأمراض التفسية
MSRpar#SP608	3.2	لقد أصاب حارس أمن ثم لاذ بالفرار، طاعنا  اثنين من المارة وهو يهرب بجانب طريق الكورنيش	ثم طعن اثنين من المارة وهو يهرب عن طريق الكورنيش بجانب البحر المتوسط
MSRpar#SP609	3.4	وقد عزا هو وزملاؤه بعض الفجوات في التواصل إلى شعور الأطباء بضغط الوقت	وقد عزا بعض فجوات التواصل إلى شعور الأطباء بضغط الوقت؛ فقد أشار المرضى إلى مشقة مناقشة القضايا المالية
MSRpar#SP610	4	قالت شرطة الدولة  إنه حوصر ما لا يقل عن 30 عاملا بعد انهيار المرآب مباشرة	وقالت شرطة الدولة، يعتقد أنه ما لا يقل عن 30 شخضا كانوا قد حوصروا بداية في الداخل
MSRpar#SP611	3.4	دعا بيكر إلى اجتماع النادي قبل صبيحة يوم الخميس، شاعرا بالقلق من أن الخلاف قد شتت أذهان الأشبال	دعا بيكر إلى اجتماع قبل المباراة، متيقنا من أن واقعة كوركد-بات قد شتتت الفريق
MSRpar#SP612	2.8	وقد نقلت بواسطة سيارة الإسعاف إلى مستشفى تشارجنغ كروس في هامرسميث	وقد نقلت إلى مستشفى تشارجنغ كروس، حيث بقيت في حالة صحية حرجة الليلة الماضية
MSRpar#SP613	3.6	ألقى بوش خطابا بالأمس شاكرا اللجنة على عملها، وقائلا:"رحلتنا إلى الفضاء ستمضي قدما"	لم يناقش السيد بوش هذا عندما أصدر بيانا مقتضبا بالأمس شاكرا اللجنة على عملها وقائلا:" إن رحلتنا إلى الفضاء ستمضي قدما"
MSRpar#SP614	4.8	كان أوس أنجيليس - "ذا هولك" وحشا في شباك التذاكرفي أول ظهور له في عطلة نهاية الاسبوع،حاصلا على رقم افتتاح شهر يونيو القياسي بـ 62.6 مليون دولار	حصل "ذا هولك" بـ62.6 مليون دولار في شباك التذاكر، على افتتاح الوحش ورقم قياسي جديد في يونيو
MSRpar#SP615	3.8	إن المحافظ ذاهب إلى جاكسون،حيث أبلغ عن 13 من وفيات الولاية الـ 16	إن الحافظ ذاهب إلى ولاية جاكسون، حيث قتل 13 شخصا
MSRpar#SP616	2.4	تهانينا على اختيارك كشخصية العام لمجلة تايم	ر
MSRpar#SP617	1.6	وبعد قليل من جرس الافتتاح، ارتفع معدل شركة دو جونز الصناعية بـ 11.13 إلى 9،228.48 ، في حين علا مؤشر S&P 500 بـ 1.74 إلى 982.33	بعد بداية ضعيفة، أنهى مؤشر دو جونز اليوم بارتفاع 26.26 إلى 9،217.35 ، بينما ارتفع مؤشر S&P 500  بـ 3 إلى 980.59
MSRpar#SP618	3.2	وفالت لائحة الاتهام غنه حضر اجتماعات مهمة للتخطيط للهجمات، وتجنيد زملاء مفجرين، وتنسيق العملية	قالت لائحة الاتهام إن سامودرا ام يتواجد في بانكوك، ولكنه حضر سلسلة من الاجتماعات قبل الهجمات، لتجنيد زملائه المفجرين وتنسيق العملية
MSRpar#SP619	3.8	بالإضافة إلى ذلك، تم منح نجمة التصنيف لهيئة الرعاية الصحية الأولية (PCTs) لأول مرة هذا العام	تم أيضا تصنيف هيئة الرعاية الأولية وإدارة الصحة النفسية رسميا ولأول مرة هذا العام
MSRpar#SP620	4.2	وستمنح أيضا فرصة لمايكروسوفت للتعليق على الحلول المقترحة من قبل اللجنة	من بين أمور أخرى، لا بد لميكروسوفت من التعليق في ردها على الحلول المقترحة
MSRpar#SP621	5	قد يحصل فريق تكسانز المثقلون بأقساط ملاك المنازل صاروخية الارتفاع في النهاية على مساعدات	تلوح المساعدات في أفق فريق تكسانز المثقل بأقساط تأمين ملاك المنازل صاروخية الارتفاع
MSRpar#SP622	3.4	يتنافس ستة ديمقراطيين لخلافة جاك ويتأهلون للانتخابات الرئيسة في 3 فبراير	يشغل ستة ديمقراطيين وجمهوريين اثنين مقعدها، وتأهلوا لانتخابات 3 فبراير الرئيسة
MSRpar#SP623	1	ارتفع مؤشر شركة ستاندرد آند بورز 500 واسعة الانتشار 3.42 نقاط، أو 0.34 في المائة، إلى 1،007.84	انخفض مؤشر شركة ناسداك التي تغلب عليها أسهم التكنولوجيا IXIC  بـ 1.55 نقطة، أو 0.09 في المائة عند 1،744.91
MSRpar#SP624	3.333	عملت الطواقم لإنشاء قنوات مائية جديدة وإعداد الطريق السريع حتى يستطيع سائقو السيارات استخدام الخطوط الشرقية للسفر حيث هددت عاصفة الغيوم بهطول أمطار غزيرة	عملت الطواقم لإنشاء قنوات مائية جديدة وإعادة تبليط الطريق السريع حتى يستطيع سائقو المركبات استخدام الخطوط الشرقية للسفر
MSRpar#SP625	4	أكدت هاليبيرتون يوم الثلاثاء مزاعمها من أن KBR قد سلمت الوقود للعراق بأفضل قيمة، وأفضل الأسعار وبأفضل الشروط	وقال ويندي هول المتحدث باسم هاليبيرتون "إننا متأكدون من أن KBR  قد سلمت الوقود للعراق بأفضل قيمة، وأفضل الأسعار وأفضل الشروط
MSRpar#SP626	3.333	أبلغت إليشيا باتيل الشرطة أنها قد أوقعت حقيبتها عندما غادرت سوق أغذية المتجر السريع الأسبوع الماضي بعد شراء التذكرة	أوقعت إليشيا باتيل حقيبها بعد ابتياعها تذكرة اليانصيب الميجا مليونية الأسبوع الماضي، وتعتقد أن التذكرة قد طارت بعيدا
MSRpar#SP628	4	فاز كليفلاند كافالييرز بالحق في تشخيص جيمز بعد فوزه بيانصيب الـ NBA السنوي ليلة الخميس	هكذا كان الحال ليلة الخميس عندما فاز كليفلاند كافلييرز "بيانصيب ليبرون جيمز" والمعروف بعبارة أخرى بيانصيب الـ NBA للمحترفين
MSRpar#SP629	3.8	من بين العمال ، وجد الباحثون أن العمال قصار القامة يتمتعون بحاسة سمع أضعف من المتوقع بالنسبة لسنهم	وكتب باريناز "يملك العمال قصار القامة حاسة سمع أضعف مما هو متوقع بانسبة للسن، عادة ثلاث مرات أكثر من العمال الأطول قامة"
MSRpar#SP630	2.2	لم يحدد السيد كولبن ما إن كان هذا النظام هو الذي كان في مركز التحقيقات	لم يحدد الأوروبي لمكافحة الغش ولا المدعي العام البلجيكي ما إن كان هذا النظام هو نفسه الذي كان في مكتب التحقيقات
MSRpar#SP631	3.75	اقتصرت مبيعات أجهزة الكمبيوتر موجهة الترفيه على الولايات المتحدة وكندا وكوريا	تباع أجهزة الكمبيوتر حاليا في كندا، والولايات المتحدة وكوريا
MSRpar#SP632	3	وكان بولمر قد أسمع في آخر تحذير أن لينوكس تمثل تهديدا لمايكروسوفت	في المذكرة ، أكد بولمر التهديد ذا المصدر المفتوح لمايكروسوفت
MSRpar#SP633	1.25	ارتفع مؤشر اسهم شركة ستاندرد آند بورز 500 المعروفة  4.83 نقاط أو 0.49 في المائة إلى 980.76	انخفض مؤشر أسهم ستاندرد آند بورز 500 الآجلة 4.40 نقاط إلى983.50 ، فيما تراجعت عقود ناسداك الآجلة 6.5 نقاط إلى 1،206.50
MSRpar#SP634	3.25	وقد أخبره طالباني إن مجلس الإدارة سيحتاج لمساعدة الأمم المتحدة والمشورة في تنفيذ القرارات الجديدة التي اتخذت	وقد أخبره طالباني إن زعماء العراق بحاجة إلى مساعدة الأمم المتحدة والمشورة في القرارات الجديدة التي اتخذت حول تنظيم حكومة عراقية مؤقتة بحلول شهر يونيو
MSRpar#SP635	3.333	يواجه ستانفورد (46-15) فريق ساوث كارولينا (44-20) اليوم في مباراة الجولة الأولى على ملعب روزنبلات في أوماها بولاية نبراسكا	يواجه ستانفورد (46-15) فريق ساوث كارولينا (44-20) يوم الجمعة في المباراة الافتتاحية ضمن بطولة الإقصاء المزدوج
MSRpar#SP637	3	تقدم مؤشر الـ SPX شركة ستاندرد آند بورز 500 المشهورة 11 نقطة، أو 1.25 في المائة ليصل إلى 931	حصل مؤشر شركة ستاندرد آند بورز 500 على 10.89، أو 1.2 في المائة إلى 931.12 اعتبارا من الساعة 12:01 مساء في نيويورك
MSRpar#SP638	2.667	قال مساعد وزير العدل الأميركي تود غرينبرغ،المدعي العام لمكافحة الإرهاب في سياتل "نحن الآن بصدد توسيع جميع المصادر المتاحة بالنسبة للتحقيق"	قال مساعد وزير العدل الأميركي تود غرينبرغ،المدعي العام لمكافحة الإرهاب في سياتل " إننا حذرون من الوضع"
MSRpar#SP639	3.667	ولكنهم لايدركون هذا حتى يفوت الأوان ( بالطبع) لأنهم ضحايا محتملون في فيلم رعب	ولكنهم لايدركون هذا حتى يفوت الأوان ( بالطبع) لأنهم ضحايا محتملون
MSRpar#SP640	3.667	قال آرثر بنسون المحامي في قضية الأطفال المدعين إنه سوف يستأنف	محامي الأطفال المدعين قال إنه يخطط للاستئناف
MSRpar#SP641	4.333	تراجع اليورو بنسبة حوالي 4 في المائة تقريبا منذ تسجيله لمستواه القياسي  بحوالي 1.1935 دولار فقط في الأسبوع الماضي ومحققا القيمة العالية على الإطلاق بـ 140.90 ينا في أواخر مايو	تراجع اليورو بما يصل إلى أربعة في المائةمنذ تسجيله لمستواه القياسي بـ1.1935 دولار تقريبا في الأسبوع الماضي، وأصاب مستوى قياسيا بـ 140.90 ينا في أواخر مايو
MSRpar#SP642	1.333	ولاية بنسلفانيا، والتي تملك أكثر نظم العلاج عدائية ، تعالج 548 من أصل 8.030 سجينا	إن ولاية تكساس ، صاحبة ما يربو على ثلاثة أضعاف عدد سجناء ولاية متشجن، تعالج 328 من سجنائها الـ 16،298 المصابين.
MSRpar#SP643	2.2	ارتفعت الأسهم المركبة شركة ناسداك المحملة بالتكنولوجيا 20.96 نقطة لتصل إلى 1595.91 وتغلق عند أعلى مسنوى لها منذ 12 شهر	صعد مؤشر الأسهم  المركبة لشركة ناسداك المعبأة تكنولوجيا 19.11 نقطة أو 1.2 في المائة لتبلغ 1،615.02
MSRpar#SP644	1.2	نزل مؤشر أسهم شركة ناسداك التكنولوجية 15 نقطة ، او 0.98 في المائة ، ليصل إلى 921	ارتفع مؤشر شركة ستاندرد آند بورز 500 المشهورة < الأوسع نطاقا> قليلا بـ 9 نقاط، أو 0.98 في المائة ليصل إلى 921
MSRpar#SP645	4.4	مع وجود ميزة الكشف، تتقلص جميع النوافذ المفتوحة لتناسب الشاشة، ولكنها تبقى بوضوح يكفي لتمييزها	مع وجود خاصية الكشف (إكس-بو-ساي)، تتقلص جميع النوافذ المفتوحة على الكمبيوتر فورا لتناسب الشاشة، ولكنها تبقى واضحة بما يكفي لتمييزها
MSRpar#SP646	3.4	عوضا عن ذلك، نفى الادعاء التهم عنه وغادر راكر قاعة المحكمة حرا طليقا	عوضا عن ذلك فإنه غادر قاعة المحكمة حرا طليقا بعد نفي التهم الجنائية عنه من قبل السلطات
MSRpar#SP647	4.2	قال جيم وولفكيل رئيس المحلفين، والوزير ذو الـ 41 عاما "مثلت هذه القضية تحديا عقليا واستنزافا عاطفيا على حد سواء"	وقال الوزير جيم وولفكيل رئيس المحلفين " كانت هذه القضية تحديا عقليا واستنزافا عاطفيا على حد سواء"
MSRpar#SP648	3	وقد وصل في نهاية هذا الأسبوع في أول زيارة دولة  يقوم بها رئيس الولايات المتحدة	يصل السيد بوش يوم الثلاثاء في أول زيارة للدولة يقوم بها رئيس أميركا
