id	sim	sent_1	sent_2
MSRpar#SP1	4	لكن مصادر أخرى مقربة من المزاد قالت  بأن فيفندي قد أبقى  الباب مفتوحا أمام المزيد من العروض وتأمل أن يرى مقدمي العروض المهتمين في الأصول الفردية كفريق واحد.	لكن مصادر أخرى مقربة من  المزاد قالت  بأن فيفندي قد أبقى الباب مفتوحا لمزيد من العروض في اليوم أو اليومين التاليين .
MSRpar#SP10	2.6	سيكون الدعم بمثابة ترقية للبرمجيات الحرة التي تسمى WebVPN وذلك للعملاء الحاليين الذين لديهم عقود  دعم .	ستكون الترقية متاحة للتنزيل مجانا للعملاء الحاليين بدعم من شبكة سمارت في شهر ينايرمن عام 2004.
MSRpar#SP100	4	لم يصرح المسؤولون عما إذا كانت القوات الأمريكية عبرت الحدود الى الأراضي السورية ،وشابها غموض عن كيفية تورط حرس الحدود السوري .	"لم يصرح مسؤولون أمريكيون عما إذا كانت القوات الأمريكية، التي تعمل لصالح المخابرات، قد عبرت الحدود الى الأراضي السورية ،وشابها غموض حول كيفية تورط الحرس السوري.
MSRpar#SP101	1.750	أدخلت شركة فيري ساين خدمتها لموقع المستكشف في 15 سبتمبر.	تستعر المعركة حول فيريساين على خدمة الموقع المكتشف منذ ثلاثة أسابيع .
MSRpar#SP103	4.500	قالت أن دروس مازال محتجزا في السجن، وهو الآن في غرفة العزل .	تم وضع دروس الليلة الماضية في غرفة العزل في السجن نفسه .
MSRpar#SP104	3.250	توفي أول العاملين في مجال الرعاية الصحية في البلاد بمرض سارس  وهو فلبيني كندي ،الذي أصيب بهذا المرض في المستشفى العام نورث يورك، الموقع الثاني من حيث انتشار المرض .	أصيبت اميلي ، البالغة من العمر51 عاما ، بالسارس ،عندما كانت تعمل كممرضة في المستشفى العام نورث يورك، مركز تفشي المرض الثاني.
MSRpar#SP105	5.000	وقد سلم زعيمهم، أبو بكر الأزدي، نفسه في شهر حزيران. حيث قتل نائبه في تبادل لإطلاق النار في الآونة الأخيرة مع القوات السعودية .	وقد استسلم قائدهم، أبو بكر الأزدي، في يونيو؛ حيث قتل نائبه في تبادل لإطلاق النار مع القوات السعودية في الآونة الأخيرة.
MSRpar#SP106	3.000	بعد البيان الافتتاحي فريتاس، أجل ملك مقاطعة المحكمة العليا القاضي تشارلز مرتل عقد المحاكمة إلى ما بعد عطلة عيد الشكر.	أجل ملك مقاطعة المحكمة العليا القاضي تشارلز ملتر عقد المحاكمة، حتى يوم الإثنين.
MSRpar#SP107	2.800	نوهت  الصحيفة  أن مسثمري جوجل هي مؤسسات رأسمالية بارزة منها : كلينر بيركنز كوفيلد ، بايرز وسيكويا كابيتال.	داعمو جوجل في مراحلها الأولى هم :جامعة ستانفورد ومقرها كاليفورنيا، الشركات الرأسمالية كلينر بيركنز وسيكويا كابيتال .
MSRpar#SP108	2.667	الأول من يوليو هو الذكرى السادسة لعودة هونغ كونغ إلى الحكم الصيني.	طغت الاحتفالات والتجمعات بمناسبة الذكرى السادسة لعودة هونج كونج إلى الصين، في 1 يوليو عام 1997.
MSRpar#SP109	4.000	أعلنت شركة النخيل  الأربعاء عن خطط للحصول على هاندسبرينغ وهي شركة شقت طريقها عن طريق جيف هوكينز، الذي يعتبره الكثيرون الأب لشركة بالم .	أعلنت شركة النخيل يوم الأربعاء أنها تعتزم شراء شركة هاندسبرينغ ، الشركة التي تم إنشاؤها من قبل المنشق بالم المؤسس المشارك جيف هوكينز.
MSRpar#SP11	4.400	حكم  يوم الجمعة ،على الرجل المتهم باستخدام قنابل وهمية للاستيلاء على طائرة كوبية سقطت في كي ويست في أبريل ، بالسجن لمدة 20 عاما	حكم يوم الجمعة على المهندس المعماري الكوبي  بالسجن 20 عاما لاستخدام قنبلتين يدويتين وهميتين لخطف طائرة ركاب  كانت متجهة من كوبا إلى فلوريدا في شهر ابريل.
MSRpar#SP110	4.400	لا أريد أن أكون راعيا لها ، ذلك لأنها ليست من اقتراحنا ، ولكن  لن أكون  سلبيا حيالها.	قال : أنا لا أريد أن أكون راعيا لها ، ذلك لأنها ليست من اقتراحنا ، ولكن من جهة أخرى   لن أرد عليها بطريقة سلبية .
MSRpar#SP111	4.250	ركنت الحكومة محادثات السلام مع الجبهة مؤخرا على الرف ،والتى تجرى بوساطة ماليزيا، ذلك بعد سلسلة من الهجمات، تشمل ثلاثة تفجيرات، في مينداناو.	ركنت الحكومة مؤخرا محادثات السلام ، والتى تجرى بوساطة ماليزيا المجاورة على  الرف ، ذلك بعد سلسلة من الهجمات في مينداناو، تشمل ثلاثة تفجيرات قاتلة ، وأنها تلقي باللوم على الجبهة .،
MSRpar#SP112	4.176	حققت الشركة خلال الفترة من العام الماضي أرباحا قدرها 54,3 مليون دولار، أو 22 سنتا للسهم الواحد .	كان ذلك ارتفاعا من ربع العام الماضي، عندما ربحت الشركة 54,3 مليون دولار، أو 22 سنتا للسهم الواحد.
MSRpar#SP113	3.000	انضمت كل من مجتمعات ماساتشوستس للووترتاون، ساجوس وفرامنجهام إلى بوسطن يوم الإثنين .	جنبا إلى جنب مع بوسطن، ستتبع كل من ووترتاون وساجوس إثنين خالي من التدخين .
MSRpar#SP114	2.500	تم تتبعه إلى أتلانتا حيث ألقي القبض عليه مساء الثلاثاء.	تم اعتقاله في أتلانتا، جورجيا، مساء الإثنين من قبل الشرطة بناء على معلومات سرية .
MSRpar#SP115	3.800	أطاح جنود إسرائيليون منازل متنقلة فارغة وخزانات للمياه في 10 بؤر استيطانية صغيرة في الضفة الغربية الليلة الماضية ،كجزء من خطة سلام في الشرق الاوسط تدعمها الولايات المتحدة.	بدأ جنود إسرائيليون بهدم بؤر استيطانية في الضفة الغربية أمس -  وهو التزام إسرائيلي بموجب خطة سلام جديدة في الشرق الاوسط .
MSRpar#SP116	4.600	لم يعلن الاتحاد بعد أي سلسلة ستكون المستهدفة .	قالت النقابة أنها ستكشف في وقت لاحق عن السلسلة المستهدفة .
MSRpar#SP117	1.400	"تخاصوا منها جميعا " هذا ما يقوله  هوارد دافيدوتز ، رئيس شركة دافيدوتزوشركاه، وهي شركة استشارية وطنية متجزئة مقرها مدينة نيويورك .
MSRpar#SP118	2.8	تشمل المنتجات المحدثة بوابة برو، بوابة القناة ، بوابة أي مكان ،وبوابة  خدمة التطبيق .	تشمل المنتجات الجديدة من جانب سطح المكتب أحدث إصدارات بوابة القناة وبوابة برو.
MSRpar#SP119	2.8	من ناحية أخرى كان ديكسون  فئة في الحقل في ميدان السباق العالمي بيكس بيك .	في نهاية المطاف ربح سكوت ديكسون سيارة هوندا إندي  225التي  تبدو سهلة يوم الأحد في ميدان السباق العالمي بيكس بيك .
MSRpar#SP12	4.2	وقال جيم وليامز، مدير مشروع زيارة الولايات المتحدة : أنه بحلول منتصف شهر نوفمبر، سيتم  أخذ بصمات  وصورالعديد من الركاب القادمين في أتلانتا	وقال جيم وليامز، مدير مشروع زيارة الولايات المتحدة :أنه بحلول منتصف نوفمبر، سيقوم المفتشون  بأخذ بصمات وصور للعديد من الركاب الأجانب القادمين إلى أتلانتا.
MSRpar#SP120	4.2	قالت السلطات التركية أن جميع المفجرين الانتحاريين كانوا من الأتراك.	تقول أنقرة أن المفجرين الانتحاريين الأربعة جميعهم من الأتراك .
MSRpar#SP121	1	من المتوقع تحقيق أرباح للعمليات التشغيلية في نيسان في حدود 60 إلى 80 سنتا للسهم الواحد.	كوداك تتوقع أرباحا من 5 سنتات إلى 25 سنتا للسهم الواحد في الربع الثالث.
MSRpar#SP122	4.2	من فلوريدا إلى ولاية ألاسكا، توعد الآلاف من المحتفلين بالضغط من أجل مزيد من الحقوق القانونية، بما في ذلك زواج المثليين .	احتفل الآلاف من الناس بالقرار ، وتوعدوا بالضغط من أجل المزيد من الحقوق القانونية، بما في ذلك زواج المثليين .
MSRpar#SP123	2.75	قبل ليلة الأحد، أحدثت الحرائق سوادا ب 277،000 فدان، على بعد مئات الأميال بعيدا.	أدت الحرائق الكبرى إلى إشعال 264،000 فدان في بداية الليلة الماضية.
MSRpar#SP124	2.5	مصر وإسرائيل، وأستراليا هم آخرون لهم نفس الوضع .	الأمم مثل إسرائيل وأستراليا لديهم بالفعل نفس الوضع.
MSRpar#SP125	3.5	تظهر النتائج في مجلة الجمعية الطبية الأميركية  التي تصدر يوم الأربعاء (مواقع الأخبار).	سيتم نشر النتائج في مجلة الجمعية الطبية الأميركية وذلك في قضية يوم الأربعاء .
MSRpar#SP126	4.75	إضافة إلى ذلك، فإن مهد h2210 لديه مكان لشحن بطارية ثانية.	مهد لh2200 لديه مكان لإعادة شحن بطارية ثانية.
MSRpar#SP127	3	قال الجيش أن القوات الأمريكية ضربت يوم الإثنين عشرات الأهداف ، أسفرت عن مقتل ستة مقاتلين واعتقال 21 آخرين.	ضربت القوات الأمريكية يوم الإثنين عشرات أهداف ، أسفرت عن مقتل ستة مقاتلين واعتقال 99 آخرين خلال 1،729 دورية و 25 غارة نقذت على مدى 24 ساعة.
MSRpar#SP128	3.5	أشار واحد من 14 كرديا إلى كلمة "لاجئ" في قاموس  إنجليزي / تركي .	استسهل أحد الرجال إلى قاموس إنجليزي-تركي وأشار إلى كلمة" "لاجئ"
MSRpar#SP129	4	قال السيد هوارد " أن التعاون الوثيق بين وكالات تنفيذ القانون وأجهزة الاستخبارات تكمن في قلب المعركة الجارية ضد الإرهاب".	قال "كان التعاون الوثيق بين وكالات تنفيذ القانون الإقليمية وأجهزة الاستخبارات ، قلب المعركة ضد الإرهاب.
MSRpar#SP13	5	وقعت الجلسة  بعد يوم من  تخصيص وزارة الدفاع الأمريكية للمرة الأولى الضابط، دلاجر، بعدم التصدي للفضيحة	وقعت الجلسة بعد يوم واحد  من إبعاد وزارة الدفاع الأمريكية للمرة الأولى الضابط دلاجر- لفشله في التصدي للفضيحة.
MSRpar#SP130	2	تقول المجموعة أنه في عام 2006 سينتعش السوق بنسبة 29.6 في المئة ، ليحقق مقدار21.3 مليار دولار من المبيعات.	في عام 2006، ستعطي شركة آجا باسيفيك تقريرا عن نمو بنسبة 7.9 في المئة ليصل إلى 81,8 بليون دولار .
MSRpar#SP131	3.2	قال الكابتن روبرت رمزي من الفرقة المدرعة  الأمريكية الأولى:  أن الشاحنة انفجرت خارج المبنى حوالي الساعة 11:00صباحا ، وأن أحد  الجدران الخارجية للمجمع قد انهارت.	قال الكابتن روبرت رمزي من الفرقة المدرعة  الأمريكية الأولى : أن الشاحنة انفجرت خارج المبنى في حوالي الساعة 11 صباحا.
MSRpar#SP132	3.6	جاءوا على الرغم مما تسميه ب.أ "الربع الصعب"، التي  قالت أنه يشمل إضرابا غير رسمي في مطار هيثرو.	قالت ب.أ :أن الربع الثاني، الذي شمل إضرابا غير رسمي في مطار هيثرو، كان صعبا
MSRpar#SP133	3.8	في هذا الخريف الشمالي سيعمل مدربون من الولايات المتحدة مع جنود من أربع دول من شمال أفريقيا ،للقيام بدوريات وجمع المعلومات الاستخبارية.	في وقت لاحق من هذا العام، سترسل القيادة المدربين مع جنود من أربع دول من شمال أفريقيا في مهام دورية لجمع المعلومات الاستخبارية.
MSRpar#SP134	5	ألقت إدارة بوش باللوم على أنصار صدام حسين والمتشددين الإسلاميين الأجانب ،الذين دخلوا العراق لقتال القوات الأمريكية ،في موجة من التفجيرات وهجمات للمسلحين.	ألقت  إدارة بوش باللوم ضد موجة من التفجيرات والهجمات التي يشنها المسلحون على الموالين لصدام والمتشددين الإسلاميين الأجانب الذين دخلوا العراق للقتال ضد القوات الأمريكية.
MSRpar#SP135	4	تبين لاحقا أنه قد كسر فخذه الأيمن والعظام في رسغه الأيمن والكوع.	أكد الأطباء المتجولون لاحقا أنه قد كسر ساقه اليمنى قرب الفخذ ،وأصيب أيضا بكسورفي الرسغ والكوع .
MSRpar#SP136	3	المؤلف هو واحد من العديد من خبراء الدفاع ، الذي من المتوقع أن  يدلي بشهادته .	من المتوقع أن يدلي سبيتزلاحقا بالشهادة للدفاع .
MSRpar#SP137	2.5	قال الدكتور باتريك بيروكس رئيس جمعية أطباء غرفة الطوارئ : أن "الأرقام أصبحت كارثية"	قال الدكتور باتريك بيلوكس  رئيس جمعية فرنسا لأطباء الطوارئ: "هذا غير مقيول "
MSRpar#SP138	3	"مهما كان قد حدث لك عن طريق العقاب ،فهو بالتأكيد أكثر من كاف"،هذا ما قاله كوفيللو البالغ من العمر 49 عاما ، الذي شغلت أسرته وأصدقاؤه و مؤيدوه نصف قاعة المحكمة.	قال كوفيللو :"ما حدث لك، يا سيدي، على سبيل العقاب، هو بالتأكيد أكثر من كاف"
MSRpar#SP139	4	زعمت الأم أيضا في الدعوى أنها تعرضت للاعتداء الجنسي من قبل أحد الحراس.	ادعت الأم أيضا أنها تعرضت للاعتداء الجنسي من قبل أحد الحراس أثناء الاشتباك عام 1998.
MSRpar#SP14	5	،قال الكاهن بنفسه  بيتر كارانجا رئيس مجلس كاتدرائية جميع القديسين في نيروبي: أن الكنيسة الأسقفية تبعد نفسها عن الطائفة الإنجيلية'	"في نيروبي، قال كاهن كاتدرائية جميع القديسين، بيتر كارانجابنفسه أن الكنيسة الأسقفية الأمريكية تبعد نفسها عن الطائفة الإنجيلية
MSRpar#SP142	2.625	نعم، من اليوم ذاكرة فلاش التي يتم  شراؤها من AMD أو فوجيتسو سيتم وصفها بسبانشن .	حلول ذاكرة سبانشن فلاش متاحة في جميع أنحاء العالم من  خلال AMD وفوجيتسو.
MSRpar#SP143	3.200	قال اثنان من أكبر صانعي السيارات في العالم أن مبيعات الولايات المتحدة انخفضت  أكثر مما كان متوقعا الشهر الماضي ، كما تسببت موجة مبيعات أواخر الصيف ردود فعل عنيفة من جهة الصناعة  أكثر مما كان متوقعا.	"انخفضت المبيعات المحلية  لكل من جنرال موتورز و شركة فورد موتوررقم 2 أكثر مما كان متكهن به  ، كما دفعت موجة المبيعات أواخر الصيف لردة فعل أكبر مما كان متوقعا  في الصناعة.
MSRpar#SP144	4	عاصفة استوائية تطورت بشكل سريع في خليج المكسيك يوم الأحد، حيث كان من المتوقع أن تضرب مكانا ما على طول سواحل تكساس أو لويزيانا يوم الإثنين ليلا .	"عاصفة استوائية تطورت بشكل سريع في خليج المكسيك يوم الأحد ، ويمكن أن تحمل رياحا بقوة الإعصار عندما تضرب الأرض في أي مكان على طول ساحل لويزيانا ليلة الاثنين.
MSRpar#SP145	3.200	قد يرتفع الضغط بشكل جيد يوم الخميس، مع التغطية المحلية للجولة النهائية التي خططت لها ESPN، شبكة كابل الألعاب الرياضية.	سوف يتكثف الضغط اليوم، مع التغطية المحلية للجولة النهائية التي خططت لها ESPN والكلمات التي هي أكثر صعوبة.
MSRpar#SP146	2.400	أشاد باتاكي بقرار إبراهيم، وقال رئيس ليبا ريتشارد كيسيل : يجب أن يبقى الكابل في العملية بشكل دائم.	"قال رئيس ليبا ريتشارد كيسيل: هذا يعني أن الكابل يمكن أن يستخدم" "كما نراه مناسبا.
MSRpar#SP147	4.4	جزء من الاتفاق كان تنفيذ مجلس الصحة الخاص الذي من شأنه  مراقبة الإنفاق على الرعاية الصحية والتقدم في إصلاح النظام الصحي.	جزء رئيسي من الاتفاق كان تنفيذ مجلس خاص لمراقبة الإنفاق على الرعاية الصحية، وتحديد الأهداف للنظام وقياس التقدم المحرز في إصلاح الرعاية الصحية.
MSRpar#SP148	3.6	جاء داين لجامعة كاليفورنيا في سان دييغو في عام 1991 بعد مرور22 عاما من عمله كفيزيائي في مختبرات بيل AT & T .	مكث داين في جامعة كاليفورنيا في سان دييغو منذ عام 1991 بعد أن أمضى 22 عاما في مختبرات بيل  AT & T ، حيث عمل على الموصلات الفائقة وغيرها من المواد.
MSRpar#SP149	2.4	انخفضت أسهم الخطوط الجوية البريطانية بنسبة 1.5 في المئة ، أي 168 بنسا ،في تمام الساعة 14:20 بتوقيت جرينتش ،  أي أقل من 164 بنسا، بشكل أقوى قليلا في سوق لندن العام .	انخفضت أسهم الخطوط الجوية البريطانية ثلاثة في المئة، أي 165-1 / 4 بنسا في الساعة 09:33 بتوقيت جرينتش ،أي أقل  من 164 بنسا، في سوق أقوى
MSRpar#SP15	5	ستضم المقاطعات مع انخفاض عدد السكان البرتقالي المائل للحمرة، البوسي والماديسون.	عدد سكان المقاطعة من البرتقالي المائل للحمرة، البوسي و الماديسون سوف ينخفض.
MSRpar#SP150	3.6	وافق مجلس الشيوخ الثلاثاء على رفع الحظر المفروض والذي مدته 10 سنوات ، وذلك في مجال بحث وتطوير  الأسلحة النووية ،ذو العائد المنخفض.	قضت قوانين كل من مجلسي النواب والشيوخ على إنهاء الحظر المفروض على البحث والتطوير في الأسلحة النووية ذو العائد المنخفض.
MSRpar#SP151	4.6	التهاب السحايا هو التهاب  في سائل الحبل الشوكي والأنسجة المحيطة بالمخ.	التهاب السحايا هو التهاب في السائل الموجود  في الحبل الشوكي و ما وحول الدماغ للإنسان .
MSRpar#SP152	4.4	صنعت كل من شركات، تشيرون وأفنتيس باستور، معا حوالي 80 مليون جرعة من حقن اللقاح،و الذي يكفي عادة لتلبية الطلب في الولايات المتحدة.	ذكرت وكالة أسوشيتد برس أن كل من شركات، تشيرون وأفنتيس باستور، عملوا  معا على إنتاج حوالي 80 مليون جرعة من حقن اللقاح،و الذي يكفي عادة لتلبية الطلب في الولايات المتحدة.
MSRpar#SP153	4.4	قال رئيس البلدية جوت. باركر مساء الخميس أن العمال الثلاثة كانوا رجلين وامرأة ، حيث كانواداخل المبنى عندما وقع الانفجار الاول.	قال رئيس البلدية جو ت. باركر :العمال المفقودون الذين كانوا داخل المبنى عندما وقع الانفجار الأول هم رجلان وامرأة .
MSRpar#SP154	4.6	قال مسؤول  المجلس ومقره لندن، علي صفوي، لرويترز: "نحن ندين هذا الهجوم، الذي هو برأينا غير قانوني ،ولا يمكن تبريره  سياسيا ولا أخلاقيا."	قال مسؤول  المجلس ومقره لندن، علي صفوي، لرويترز عبر الهاتف: "نحن ندين هذا الهجوم، الذي هو برأينا غير قانوني ،ولا يمكن تبريره  سياسيا ولا أخلاقيا."
MSRpar#SP155	4.4	اكتشف المحققون وجود  شظية بطول4 إنشات ،وذلك  داخل عظمة كانت تحت بلاطة اسمنتية يوم الخميس، إلا أنه تبين أن تكون عظام حيوانات.	اكتشف المحققون وجود شظية داخل عظمة بطول 4 بوصة ليلة الخميس، لكن السلطات قالت أنها عظمة حيوان.
MSRpar#SP157	3.6	انفجرت بين يديه، ولكن رئيس الوزراء الإيطالي السابق لم يصب بأذى.	الرسالة عبارة عن قنبلة ، تم إرسالها إلى برودي الذي انفجرت بين يديه لكنه لم يصب بأذى.
MSRpar#SP158	4.2	نحو 95 مليون أميركي - نصف الأسر -يستثمرون في صناديق الاستثمار المشترك.	ما يقرب من نصف مجموع الأسرفي الولايات المتحدة لديهم أموال في صناديق الاستثمار المشترك.
MSRpar#SP159	3.2	نفى المحامي العسكري الحلبي في سلاح الجو، الميجور جيمس كي، الاتهامات التي يمكن أن تحمل عقوبة الإعدام.	نفى المحامي جيمس كي الثالث الذي يمثل الحلبي ، نفى هذه الاتهامات،ذلك وفقا لأسوشيتد برس .
MSRpar#SP16	3.4	قال شوارتز، الذي اتهم في فبراير الماضي، بأن نيو هامبشاير كان المكان الخطأ لاتهامه.	كان شوارتز قد سعى لرفض الاتهام ، قائلا إن نيو هامبشايركان المكان الخطأ لتوجيه الاتهام له.
MSRpar#SP160	2	قال وسكال برسالة إلى المحكمة: " مزقت عائلتي إربا .	اعتذروسكال للمحكمة، وموظفيه وعائلته، ذلك طلبا منه للتساهل .
MSRpar#SP161	2.8	قال جاير:تلقت المدينة منذ أوائل مايو، 1400 تقريرا عن الغربان الزرقاء الميتة.	قال :منذ أوائل مايو، تلقت المدينة 1400 تقريرا .
MSRpar#SP162	1.6	لكن فورست، منظمة الحرية للحق في التمتع بتدخين التبغ، قالت: '' أذكروا كلمة حظر، ليعرف الجميع ماذا حدث هناك.	"قالت منظمة فورست للحق في التمتع بتدخين التبغ، أنها استقبلت دعوة لانسيت ل" "التسلية والكفر"
