id	sim	sent_1	sent_2
SMTeuroparl#SP10	4.8	بالنيابة عني و عن زملائي في لجنة الصيد البحري، أود أن أطلب منكم، سيدتي الرئيسة، ٳرسال تعازي البرلمان لأسر الضحايا بكل من بريتاني و مارين بغالسيا، موطن غالبية الضحايا.	سيدتي الرئيسة، أود أن أطلب منكم نيابة عن زملائي في لجنة الصيد البحري و نيابة عني بعث رسالة تعزية من قبل البرلمان لأسر الضحايا و السلطات المحلية في بريتاني كما مارين مدينة غالسيا من أين ينشأ جل الضحايا.
SMTeuroparl#SP11	4.8	يمكن للمرء بالفعل أن يرغب فيما هو أكثر و في التحسين، و لكن أعتقد بصراحة أننا قد قمنا ببداية جيدة.	يستطيع المرء بالفعل أن يرغب فيما هو أكثر و أفضل، لكن أعتقد بصراحة كبيرة أنها بداية جيدة.
SMTeuroparl#SP13	4.5	شكرا لك أيها المفوض.	شكرا جزيلا لك، سيدي المفوض.
SMTeuroparl#SP18	5	ٳن هناك تفسيرات لازمة لِارتفاع حدوث مرض جنون البقر ليس فقط في فرنسا و ٳنما في الدول الأعضاء الأخرى أيضا.	من الضروري بوضوح أنه يجب ي تحديد أسباب الزيادة في حالات الٳصابة بمرض جنون البقر ليس فقط في فرنسا و ٳنما في الدول الأعضاء الأخرى أيضا.
SMTeuroparl#SP19	4.8	السيد الرئيس، موقف لجنة التحقيق من حق الحصول على الوثائق يمكن أن يستشف من الكتيب الداخلي الذي بعث في الحادي عشر من أكتوبر لموضفي اللجنة ليشرح لهم كيفية التعامل مع مطالب أعضاء مجلس البرلمان الاوروبي للحصول على الوثائق.	سيدي الرئيس، نستطيع أن نلاحظ موقف لجنة التحقيق فيما يتعلق بالحصول العلني على الوثائق بقراءة الدليل الدخلي الذي تم اِسناده لها في الحادي عشر من اكتوبر مع مسؤولي اللجنة لشرح الطريقة التي يجب أن يتعامل بها بكل اِحترام مع الطلبات المقدمة من الأعضاء فيما يتعلق بالحصول على الوثائق.
SMTeuroparl#SP20	4.8	أشدد على هذه النقطة لأن السوق لا يمكن أن ينظم كل شيء و لهذا السبب المنافسة ليست غير مقيدة تماما و لا ينبغ لها أن تكون.	أنا أصر على هذه النقطة لأن السوق لا يمكن أن ينظم كل شيء، و أنه و نظرا لذلك، ليس هنالك و لا يمكن أن يكون هنالك منافسة بدون حدود.
SMTeuroparl#SP21	4.4	ٳذا، هو ليس مؤكد بأي شكل من الأشكال، أن التعريف المقترح للسعر العادل هو أفصل من أي تعريف آخر لأن التعاريف المتعددة التي يتم اِستخدامها حاليا من قبل الدول الأعضاء هي كلها مرضية تماما.	ٳذا هو ليس من المؤكد ٳطلاقا أن تعريف السعر العادل المقترح هو أفضل من تعريف آخر لأن التعاريف المختلفة مي حاليا مستخدمة في الدول الأعضاء هي كفاية و كفاية.
SMTeuroparl#SP23	4.8	كما ٳنني صوت ضد نص يدعو ٳلى ضم ميثاق الحقوق الأساسية في معاهدة نيس الأخيرة.	أنا أيضا صوتُ ضد نص يطلب ضم ميثاق الحقوق الأساسية في المعاهدة المستقبلية التي سوف يتم تبنيها في نيس.
SMTeuroparl#SP25	5	خمس و سبعون عضوا من أعضاء مجلس الشيوخ، من بينها أربع و عشرون من الجمهوريين، قد وقعوا على الرسالة.	من بين الذين وقعو على الرسالة سبع و خمسون هم أعضاء مجلس الشيوخ من بينهم أربع و عشرون من الجمهوريين.
SMTeuroparl#SP26	4.4	أجد أنه من الغريب أن الناس يحاولون، مبكرا هكذا، تقييد أيدي اللجنة فيما ينعلق بالمقترح التوجيهي، في حين أنهم يطالبون منها تقديم ورقة خضراء بخصوص الوضع الراهن فيما يتعلق بخطة التأمين الصحي الِاختاري و التكميلي.	أجد أنه من الغريب قليلا اِلزام اللجنة الآن بٳقتراح قرار و أن يطلب منها، في نفس الوقت، صياغة ورقة خضراء بشأن الحالة الراهنة للتأمين الِاختياري و التأمين المرضي التكميلي.
SMTeuroparl#SP30	4.6	أود أن أحث الرئاسة الفرنسية على بذل قصارى جهدها لتجاوز هذا الِانقسام لأنه مدمر للغاية.	ٳنني أحث الرئاسة الفرنسية على أن تقوم بكل شيء في وسعها لرأب الصدع المدمر بصفة خاصة.
SMTeuroparl#SP31	4.4	بالتأكيد على الدعوات المقدمة من قبل البرلمان الأوروبي في قراره الصادر في 16 مارس 2000، ماهي المبادرات التي قدمتها رئاسة المجلس الأوروبي لتأخذ بعين الِاعتبار للعب دور أكثر نشاطا حتى تضمن التطبيق الكامل و التام لخطة الأمم المتحدة للسلام ؟	كما الشأن للبرلمان الأوروبي في قراره الصادر في 16 مارس 2000 و التي هي مبادرات ، فهل ينوي من خلالها المجلس أن يلعب دورا أكثر نشاطا من أجل ضمان التطبيق الشامل و الكامل لخطة الأمم المتحدة للسلام ؟
SMTeuroparl#SP33	4.8	سيدي الرئيس، أود أن أركز في حديثي على تقرير السيدة لالميار و الذي أظن أن كلماته مختارة بوضوح و موضوعة جيدا مع بعضها.	- سيدي الرئيس، في خطابي سأركز على تقرير السيدة لالميار الذي أجده مخططا جيدا على مستوى الأفكار و بوضوح.
SMTeuroparl#SP36	4.4	السيد الرئيس، سيداتي سادتي، أود أن أقول بعض كلمات بخصوص القرار المشترك و الذي سوف يمرر بطبيعة الحال.	السيد الرئيس، سيداتي سادتي، أود أن أتكلم بخصوص القرار المشترك الذي من الواضح صوتنا بشأنه.
SMTeuroparl#SP37	4.6	أدعو براغ للرد على هذه الإشارة، هذا التحدي، هذا النداء من أجل الحوار لمنح طلبنا و لضمان ،بمعية مجلسنا , أن هذا الإرث من الحقبة القومية يمكن أن يرسل ٳلى الماضي.	أنا أشجع براغ على أن تأخذ هذه الرسالة، هذه الدعوة، هذا الطلب للحوار، أن تعمل و أن تنجح فيه حتى يمكن، بمعية هذا المجلس، لهذه الآثار من الفترة القومية التخلي عنها.
SMTeuroparl#SP38	4.6	يجب أن يكون هنالك بصدق مركزا لتنسيق شبكة الوكالات الوطنية التي بدورها يجب أن تحرك و تنسق شبكة من مراكز اِمتياز للسلامة الغذائية على مستوى كل منطقة على حدة.	يجب أن يكون هناك شبكة ذكية للتنسيق بين الوكالات الوطنية، و التي بدورها يجب أن تحرك و تنسق شبكة من مراكز اِمتياز للسلامة الغذائية على المستوى المحلي.
SMTeuroparl#SP40	4.8	أثناء سحب القرار، أعرب عن قناعتي أن هذا البرلمان كان من شأنه أن يجعل صوته مسموعا أكثرٳذا كرس ،في اِنتضار مجلس نيس، قرارا محددا و مفصلا لهذه المواضيع المهمة و الصعبة للمؤتمر الدولي بدلا من التعامل معها في قرار واحد و الذي يتضمن جميع النقاط الأخرى على جدول أعمال المجلس.	من خلال سحب قرارنا، أنا مقتنع رغم ذلك أن البرلمان كان بٳمكانه القيام بأكثر من ذلك بجعل صوته مسموعا فيما يخص المجلس الأوروبي بنيس، قرار مفصل و محدد بشأن هذه المواضيع التي تعتبر مهمة و صعبة للغاية للمؤتمر الحكومي بدل التعامل معهم في ٳطار قرار موحد يتضمن كذلك كل البنود الأخرى المدرجة على أعمال المجلس.
SMTeuroparl#SP41	4.4	مجلس أوروبا، مثل محكمة حقوق الإنسان، لديه خبرة ثمينة بخصوص هذه الأشكال من الرقابة و نستطيع أن نبني عليها.	تماما مثل المحكمة الأوروبية لحقوق الإنسان، المجلس الأوروبي لديه خبرة كبيرة فيما يتعلق بهذه الأشكال للسيطرة نستطيع أن نأخذها كأساس.
SMTeuroparl#SP42	5	لقد بدأنا تبادل الأفكار حول هذه المسألة و التي تبين منها أن جميع الدول الأعضاء يرغبون في المحافظة على هذا السقف بعد التوسعة.	لقد بدأنا في ٳجراء مناقشات بشأن هذا الموضوع، و هو ماجعله واضحا أن كل الدول الأعضاء يرغبون في المحافظة على هذا السقف بعد التوسعة.
SMTeuroparl#SP43	5	أولا تبسيط و توضيح المعاهدات.	أولا أن تبسط و توضح المعاهدات.
SMTeuroparl#SP45	4.8	بدون شك، كان من الأفضل ألا يكون هنالك اِتفاق على الإطلاق بدلا من الِاتفاق الهزيل و صحيح في هذه الحالة، أن المقترح الأمريكي هو اِقتراح من الدرجة الثالثة، و هو الذي كان غير مقبول تماما بالنسبة لأوروبا.	بدون شك، كان من الأفضل أن لا يكون هناك اِتفاق فقط ليكون هناك اِتفاق على هذا السيء، و في هذه الحالة، المقترح الأمريكي كان مقترح للتنازل غير مقبول تماما بالنسبة لأوروبا.
SMTeuroparl#SP47	5	النقاش المشترك قد أغلق.	النقاش المشترك قد أغلق.
SMTeuroparl#SP49	5	ٳذا أردنا أن نساعد أندونيسيا يجب أن نتحرك الآن بالمال و الأفعال، و ليس بمجرد الكلمات.	ٳذا أردنا أن نساعد أندونيسيا يجب أن نتدخل الآن باـمال و النشاطات، و ليس فقط بالكلمات.
SMTeuroparl#SP51	4.857	هذا أيضا موقف يوصي به المقرر و يشاركه فيه حزب الشعب الأوروبي.	ٳنه الموقف المدافع عنه من قبل المقرر و المشترك من قبل حزب الشعب الأوروبي.
SMTeuroparl#SP52	4.667	من الواضح أن هناك تفسيرات لازمة لِارتفاع حدوث مرض جنون البقر ليس فقط في فرنسا، و ٳنما في الدول الأعضاء الأخرى أيضا.	يجب أن نحدد أسباب هذا الِارتفاع في حالات الإصابة بمرض جنون البقر ليس فقط في فرنسا و لكن في الدول الأعضاء أيضا.
SMTeuroparl#SP54	4.4	أخيرا و الأكثر ٳثارة للجدل، دعت اللجنة بقوة ٳلى اِستخدام ٳجراء المسار السريع لتطبيق هذا التشريع.	أخيرا و هذا موضوع مثير للجدل أكثر، دعت اللجنة بقوة ٳلى اِستخدام ٳجراء المسار السريع لتطبيق هذا التشريع.
SMTeuroparl#SP55	4.4	سوف يواصلون الضغط و هم يعززون موقفهم بالإيرادات التي يتحصلون عليها من توصيل البريد فوق 150غرام.	واصلوا الضغط، المال الذي يكسبونه من التوزيع خارج حدود 150 غرام يسمح لهم بتعزيز موقفهم.
SMTeuroparl#SP56	4.6	ٳذاكنا نريد أن نساعد أندونيسيا يجب أن نتحرك الآن بالمال و الافعال، و ليس بمجرد الكلمات.	ٳذا كنا نريد مساعدة أندونيسيا يجب أن نتكلم الآن بالمال و الاعمال الملموسة، و ليس فقط بالكلمات.
SMTeuroparl#SP59	4.6	أدعو براغ للرد على هذه الإشارة، هذا التحدي، هذا النداء من أجل الحوار لمنح طلبنا و لضمان، بمعية مجلسنا، أن هذا الإرث من الحقبة القومية يمكن أن يرسل ٳلى الماضي.	أنا أدعو براغ لاغتنام هذه العلامة هذه الدعوة، هذا الطلب للحوار، أن تتخذ الإجراءات المتعاقبة وأن تلتزم بها إلى أن باتصال بهذا البرلمان هذه الآثار القومية القديمة يمكن أن يتم التخلي عنها.
SMTeuroparl#SP60	4.6	يجب علينا تحديد أسباب الإرتفاع في حالات الإصابة بمرض جنون البقر ليس فقط في فرنسا ولكن أيضا في الدول الأعضاء.	بالرغم من ذلك، أود أن أقول للمجلس بعد الظهر هذا اليوم أنه يجب علينا أن لا نغفل عن حقيقة أن الِاتحاد الاوروبي ينفق فقط 1% من الناتج المحلي الإجمالي للدول الأعضاء، و أن الجزء الأكبر من هذه الأموال تدار في الدول الأعضاء.
SMTeuroparl#SP64	5	هذه الأهداف، الهدف المهمّ منها والثانويّة، سوف تكون المعيار الّذي يحكم من خلاله على المقترحات الملموسة الّتي قدّمتها اللّجنة.	هذه الأهداف، الهدف الأسمى منها والأهداف الثانويّة، سوف تكون المعيار الّذي من خلاله سوف نحكم على المقترحات المستقبليّة الملموسة من قبل اللّجنة.
SMTeuroparl#SP65	4.8	المجلس الأوروبي سوف يناقش كذلك حالة التقدّم في مفاوضات الإنضمام وبالتالي التوسيع.	وأضاف أنّ المجلس الأوروبي سوف يناقش حالة التقدّم في مفاوضات الانضمام وبالتالي التوسيع.
SMTeuroparl#SP66	4.4	حزبي لديه تحفظات جديّة بشأن القانون المجتمعي الذي يطبّق على بيع المنتجات الإستهلاكيّة مقابل تطبيق مفهوم الإعتراف المتبادل بالمعايير.	حزبي لديه تحفظات عميقة حول تنظيم بيع السلع الإستهلاكيّة عن طريق التشريع كما أنّه يعبّر عن تحفظات بشأن مفهوم الإعتراف المتبادل بالمعايير.
SMTeuroparl#SP70	4.75	لذلك أعتقد أنّ هذه المصالحة هيّ مستدامة ولكن إنّ هذه الحكومة الّتي وجدت بشجاعة فائقة حلا لقضيّة الجامعة وللعديد من القضايا، تحتاج إلى علامات واضحة لنجاحها ودعما قويا، وإلاّ فالسلام في جميع أنحاء المنطقة سوف يكون محلّ تهديد.	لذلك أعتقد أيضا أنّ هذه المصالحة يمكن أن تأخذ ولكنّ الحكومة الّتي وجدت بشجاعة فائقة حلاّ لقضيّة الجامعة وللعديد من المشاكل تحتاج إلى علامات واضحة للنّجاح كما تحتاج إلى دعم قويّ مخافة أن يتمّ تهديد السلام في المنطقة.
SMTeuroparl#SP71	5	ٳن هناك تفسيرات لازمة لِارتفاع حدوث مرض جنون البقر ليس فقط في فرنسا و ٳنما في الدول الأعضاء الأخرى أيضا.	يجب علينا بكلّ وضوح أنّ نحدّد أسباب الارتفاع في حالات الإصابة بمرض جنون البقر، ليس فقط في فرنسا ولكن في الدول الأعضاء أيضا.
SMTeuroparl#SP73	4.6	بالتأكيد على الدعوات المقدمة من قبل البرلمان الأوروبي في قراره الصادر في 16 مارس 2000، ماهي المبادرات التي قدمتها رئاسة المجلس الأوروبي لتأخذ بعين الِاعتبار للعب دور أكثر نشاطا حتى تضمن التطبيق الكامل و التام لخطة الأمم المتحدة للسلام ؟	مثلما قد دعا البرلمان الأوروبي في قراره 16 مارس 2000 أنّهم مبادرات رئاسة المجلس الأوروبي تنوي إتّخاذها للعب دور أكثر نشاطا من أجل ضمان التطبيق التام لخطّة الأمم المتحدة للسلام.
SMTeuroparl#SP75	4.8	أتساءل عمّا إذا كان المفوضّ قد صمّم أي خطوات في هذا الصدد ليتبيّن أنّ كوستونيتشا الممثل الشرعي المنتخب الوحيد الّذي يتعامل معه الإتحاد الأوروبي من هذا اليوم.	أتساءل عمّا إذا كان المفوض قد قدم الخطوات التي من شأنها أن تجعل من الممكن إظهار أننا نعتبر كونيتشا ممثلا قانونيا منتخبا للشعب الصربي و كشريك معه سيخاطب الإتحاد الأوروبي الآن.
SMTeuroparl#SP76	4.6	وضع العلامات على لحوم البقر الّتي تمّ الإتفاق عليها والّذي شكل الحدّ الأدنى لوضع العلامات والّذي بدأ سريانه منذ شهرين ونصف لا يجعل من الممكن تعقّب مصدر الحيوانات بشكل كاف وكنّا بطيئين جدا لحظر المواد المحدّدة منها.	وضع العلامات على لحوم البقر الّذي تمّ إقراره، الّذي هوّ الحد الأدنى ووضع العلامات الّذي سرى مفعوله لشهرين ونصف لا يتعقّب مصدر الحيوانات بشكل صحيح ولقد حضرنا مؤخّرا قليلا المواد الخطيرة المحدّدة.
SMTeuroparl#SP80	5	الهدف من المراجعة السنويّة هوّ تحديد التحسينات المحتملة.	يهدف التقرير السنوي إلى تحديد التحسينات المحتملة.
SMTeuroparl#SP81	4.8	هناك حاجة ملحّة عقب الهجمات الأخيرة على الأقليّة اليونانيّة بهيمرا إلى تعزيز التدابير الديمقراطيّة وتدابير لتعزيز المؤسّسات وإحترام حقوق الإنسان في ألبانيا.	الأحداث الأخيرة ضدّ الأقليّة اليونانيّة بهيمرا جعلت أكثر إلزاما إحتياجنا تعزيز التدابير لإرساء الديمقراطيّة، بناء المؤسّسات وإحترام حقوق الإنسان في ألبانيا.
SMTeuroparl#SP84	4.8	وأنا أقول لك بصوت عال ووضاح، كوستونيتشا يجب أن يعطي العفو في الأسبوعين أو الشهرين المقبلين، ولكن وفي الوقت نفسه أنا أريد بشدّة إدراج هذان الخطّان في بنود الميزانيّة: التحوّل الدّيمقراطي وإعادة الأعمار، أن يكونا مصحوبين بالظروف السياسيّة سواء من منظور سياسي أو مالي.	وأقول هذا لك بوضوح، يجب أن نعطي فرصته لكوستونيتشا، وبالتالي آمل أنّها سوف تضمن عفوا خلال الأسابيع أو الأشهر المقبلة، ولكن وفي هذه الأثناء من الناحية السياسيّة ومن النّاحية الماليّة، الظروف السياسية هي مرتبطة بإدراج هذان البندان الجديدان بالميزانيّة وأسمّي هنا الدّيمقراطيّة وإعادة الأعمار.
SMTeuroparl#SP86	5	أخيرا، و في كلمة، الركن الرابع المكرس لتكافؤ الفرص يعزز طريقا متكاملا لتحقيق المساواة من خلال مراعاة المنظور الجنساني و من خلال مبادئ عامة توجيهية.	أخيرا، و في كلمة، الركن الرابع المكرس لتكافؤ الفرص يعزز طريقا متكاملا لتحقيق المساواة من خلال مراعاة المنظور الجنساني و مبادئ عامة توجيهية.
SMTeuroparl#SP89	4.9	معرفة اللغات الأجنبية مقبول كأداة للتحرك.	من المسلم به أنّ معرفة اللغات الأجنبية شرط أساسي للتحرّك.
SMTeuroparl#SP90	4.4	يجب أن يكون هنالك بصدق مركزا لتنسيق شبكة الوكالات الوطنية التي بدورها يجب أن تحرك و تنسق شبكة من مراكز اِمتياز للسلامة الغذائية على مستوى كل منطقة على حدة.	يجب أن يكون هناك شبكة ذكية للتنسيق بين الوكالات الوطنية، و التي بدورها يجب أن تحرك و تنسق شبكة من مراكز اِمتياز للسلامة الغذائية على المستوى المحلي.
SMTeuroparl#SP92	4.4	قد سمعنا أنّ رئاسة المجلس السابقة أوّلا هيكلت ثمّ ألغت وزارة المساواة.	لقد سمعنا أنّ الرئاسة السابقة قد هيكلت ثمّ قامت بتفكيك وزارة تكافئ الفرص.
SMTeuroparl#SP96	5	البرلمان قبل التعديل الشفوي.	البرلمان قبل التعديل الشفوي.
SMTeuroparl#SP97	4.6	(ES) السيد الرئيس، التوسيع أمر ضروري لبناء قارّة أوروبيّة قويّة وموحدّة.	السيّد الرّئيس، التوسيع أمر ضروري من أجل بناء قارّة قويّة وممتدّة في أوروبا.
SMTeuroparl#SP99	5	حول الوضع في بورما.	حول الوضع في بورما.
SMTeuroparl#SP100	5	الرئاسة الفرنسيّة تشكركم، سيدتي الرئيسة، على هذا التعاون، على هذا الدّعم، وعلى حفاوة الإستقبال الّذي قدّمتموه لنا.	لهذا التعاون، ولدعمكم و لترحيبكم الحار، سيدتي الرئيسة، السيّدات والسادة، الرئاسة الفرنسيّة تشكركم.
SMTeuroparl#SP101	4.6	درس هذا البرلمان لهذا الصباح يجب أن يكون أننا يجب أن نخلص إلى أنّ القوانين البحرية في جميع أنحاء العالم هي في حالة من الفوضى و يجب علينا أن نبدأ سلسلة من التغيرات لوضعهم في الوضع الصحيح.	الدرس الذي يجب أن يحتفظ به هذا المجلس في مناقشته لهذا الصباح هي أننا مجبورون إلى أن نخلص إلى أنّ القوانين هي بحرية في جميع أنحاء العالم، في حالة من الفوضى، و أننا يجب أن نطيل النظر في مهمتهم لجلب النظام.
SMTeuroparl#SP104	4.8	لسوء الحظ، آخر هدف لدستور أوروبي سوف يكون تماما العكس، و كنتيجة لذلك، لن نستطيع بالطبع التصويت له.	لسوء الحظ الهدف الأخير لدستور أوروبي سوف يكون تجديدا العكس و بالطبع لا أن نستطيع أن نوافق.
SMTeuroparl#SP105	4.6	خطوة في الإتجاه الصحيح و التي قد كان الِاتحاد الأوروبي يسعى جاهدا من أجل تحقيقها لفترة طويلة الآن هي ٳنشاء وحدة مؤقتة للتعاون القضائي.	إنّ انشاء وحدة مؤقتة للتعاون القضائي هي خطوة في الإتجاه الصحيح، التي قد كان البرلمان الأوروبي يسعى من أجل تحقيقها لفترة طويلة.
SMTeuroparl#SP106	5	إغلاق النقاش	إغلاق النقاش
SMTeuroparl#SP107	4.4	أولئك الذين يرفضون و يتمتعون بنفس حرية التنقل مثل المسافر خارج سيارة.	أولئك الذين يرفضون التعاون المعزز عندهم نفس حريّة التنقل التي الركاب المقعد الخلفي لسيارة.
